### ISSUE TITLE
Proxmox VE Helper LXC not reading env variables

### ISSUE THREAD

**Issue by theunreal89** [ThePhaseless/Byparr#302]
### I've completed the following steps:

- [x] Read Loop Warning on Readme
- [ ] Used --init/init: true in docker run/compose.yaml
- [ ] Done the troubleshooting from Readme
- [x] Checked if such issue already exists
- [ ] Checked other websites with Cloudflare Turnstile
- [x] I am able to access the webpage from my browser
- [ ] (Docker only) Checked that the problem does also occur on main tag

### If checked other websites with Cloudflare Turnstile:

- [ ] Other websites do work.
- [ ] Other websites do not work.

### OS/Docker Host

Proxmox VE 9.1.4

### Platform and model

Proxmox VE Helper LXC, Debian 13, Byparr v2.0.1

### Architecture

x86_64

### Describe the bug

Using Proxmox Helper LXC container https://community-scripts.github.io/ProxmoxVE/scripts?id=byparr&category=*Arr+Suite and environment variables are not read correctly.

Not working case
root@byparr:~# env | grep PROXY
PROXY_SERVER=socks5://proxy.local.lan:1080
root@byparr:/opt/Byparr# cat src/consts.py | grep PROXY_SERVER
PROXY_SERVER = os.getenv("PROXY_SERVER")
after restart -> directly exiting on WAN uplink
3:47:46.994180 eth0  Out IP 192.168.89.103.43106 > 185.199.109.133.443: Flags [.], ack 12676, win 81, options [nop,nop,TS val 3366009183 ecr 2702280037], length 0
23:47:46.997005 eth0  In  IP 185.199.109.133.443 > 192.168.89.103.43106: Flags [.], ack 2378, win 268, options [nop,nop,TS val 2702280040 ecr 3366009182], length 0
23:47:47.091194 eth0  Out IP 192.168.89.103.58416 > 104.18.95.41.443: UDP, length 1252
23:47:47.091229 eth0  Out IP 192.168.89.103.58416 > 104.18.95.41.443: UDP, length 1252
23:47:47.091272 eth0  Out IP 192.168.89.103.58416 > 104.18.95.41.443: UDP, length 1252
23:47:47.091284 eth0  Out IP 192.168.89.103.58416 > 104.18.95.41.443: UDP, length 769

Working case: manually putting the env variable value instead of relying on os.getenv:
root@byparr:/opt/Byparr# cat src/consts.py | grep PROXY_SERVER
PROXY_SERVER = "socks5://proxy.local.lan:1080"
after restart -> using SOCKS5 proxy
root@byparr:/opt/Byparr# tcpdump -nnpi any port 443 or port 1080
tcpdump: verbose output suppressed, use -v[v]... for full protocol decode
listening on any, link-type LINUX_SLL2 (Linux cooked v2), snapshot length 262144 bytes
23:53:55.462865 eth0  Out IP 192.168.89.103.51482 > 192.168.89.1.1080: Flags [S], seq 1633068169, win 64240, options [mss 1460,sackOK,TS val 545805964 ecr 0,nop,wscale 10], length 0
23:53:55.463280 eth0  In  IP 192.168.89.1.1080 > 192.168.89.103.51482: Flags [S.], seq 2079988581, ack 1633068170, win 65160, options [mss 1460,sackOK,TS val 275918727 ecr 545805964,nop,wscale 6], length 0
23:53:55.463295 eth0  Out IP 192.168.89.103.51482 > 192.168.89.1.1080: Flags [.], ack 1, win 63, options [nop,nop,TS val 545805965 ecr 275918727], length 0
23:53:55.463382 eth0  Out IP 192.168.89.103.51482 > 192.168.89.1.1080: Flags [P.], seq 1:4, ack 1, win 63, options [nop,nop,TS val 545805965 ecr 275918727], length 3->

**Comment by vhsdream** [comment]
The helper script does not configure any environment variables for you. How are you setting them? Since the service is running via systemd, you may need to set them in the `byparr.service` file via `Environment=PROXY_SERVER="socks5://proxy.local.lan:1080"` or alternatively create an `.env` file with the vars and use `EnvironmentFile=/path/to/your/.env`.

**Comment by theunreal89** [comment]
> The helper script does not configure any environment variables for you. How are you setting them? Since the service is running via systemd, you may need to set them in the `byparr.service` file via `Environment=PROXY_SERVER="socks5://proxy.local.lan:1080"` or alternatively create an `.env` file with the vars and use `EnvironmentFile=/path/to/your/.env`.

Hello, thanks for you reply. I confirm what you suggested, adding it into systemd service made it work. I'm sorry, I didn't know systemd services aren't using normal system enviroment variables set by running shell (done with "export PROXY_SERVER" o putting in into .bashrc and sourcing it)

IMHO, there should be a small guide on how to add these enviromental variables for byparr when not using Docker into your documentation, to avoid other people to do the same kind of mistake.

**Comment by CrazyWolf13** [comment]
@theunreal89 another maintainer from community scripts here, just stumbled upon this :D 

This process is mostly the same for all of our LXC, either there is a dedicated env file, or if there are not really a lot of env vars needed, there is just the service file.

But I have created a PR to add the service file as "config file" so it will displayon the website:

https://github.com/community-scripts/ProxmoxVE/pull/11120

**Comment by theunreal89** [comment]
> [@theunreal89](https://github.com/theunreal89) another maintainer from community scripts here, just stumbled upon this :D
> 
> This process is mostly the same for all of our LXC, either there is a dedicated env file, or if there are not really a lot of env vars needed, there is just the service file.
> 
> But I have created a PR to add the service file as "config file" so it will displayon the website:
> 
> [community-scripts/ProxmoxVE#11120](https://github.com/community-scripts/ProxmoxVE/pull/11120)

Hello @CrazyWolf13, I didn't know that either so thank you a lot for your help and contribution too!
